{
  "schema_version": "1.0",
  "id": "M-01KFGH1PZYC5FWJQS3D9X1REES",
  "title": "Release 0.1",
  "status": "closed",
  "created_at": "2026-01-21T14:58:57.150513Z",
  "updated_at": "2026-01-21T14:58:57.178854Z",
  "due_at": "2026-03-01T00:00:00Z",
  "description": "General availability",
  "tags": [
    "release",
    "seed"
  ]
}